{
  "name": "team-pipeline-new-feature",
  "version": "1.0.0",
  "type": "pipeline",
  "description": "Pipeline for adding features to existing projects",
  "capabilities": [
    "feature-planning",
    "feature-implementation",
    "feature-testing",
    "feature-deployment",
    "iterative-development",
    "feature-validation"
  ],
  "dependencies": [],
  "settings": {
    "type": "pipeline",
    "domains": {},
    "compatible_pipelines": []
  }
}