{
  "name": "software-engineer",
  "version": "1.0.0",
  "description": "Full-stack software development with backend, frontend, and general coding capabilities",
  "type": "role",
  "capabilities": [
    "backend",
    "frontend",
    "full-stack",
    "api-development",
    "database",
    "rest",
    "graphql",
    "authentication",
    "state-management",
    "responsive-design"
  ],
  "dependencies": [],
  "settings": {
    "categories": [
      "development",
      "full-stack",
      "backend",
      "frontend"
    ],
    "update_mode": "compatible",
    "python_min": "3.8",
    "node_min": "14",
    "domains": {
      "backend": {
        "enabled": true,
        "technologies": [
          "python",
          "nodejs",
          "java",
          "go",
          "rust"
        ]
      },
      "frontend": {
        "enabled": true,
        "technologies": [
          "react",
          "vue",
          "angular",
          "vanilla-js"
        ]
      },
      "graphics": {
        "enabled": false,
        "technologies": [
          "webgl",
          "three.js",
          "canvas"
        ]
      },
      "ml": {
        "enabled": false,
        "technologies": [
          "tensorflow",
          "pytorch",
          "scikit-learn"
        ]
      },
      "data": {
        "enabled": false,
        "technologies": [
          "pandas",
          "numpy",
          "spark"
        ]
      }
    },
    "compatible_pipelines": []
  }
}