{
  "name": "team-pipeline-auto-review",
  "version": "1.0.0",
  "type": "pipeline",
  "description": "Automated code review pipeline for PRs and commits",
  "capabilities": [
    "automated-code-review",
    "lint-checking",
    "static-analysis",
    "security-scanning",
    "test-validation",
    "coverage-checking",
    "code-quality-metrics"
  ],
  "dependencies": [],
  "settings": {
    "domains": {},
    "compatible_pipelines": []
  }
}