{
  "name": "team-pipeline-fix-bug",
  "version": "1.0.0",
  "type": "pipeline",
  "description": "Focused pipeline for rapid bug fixing",
  "capabilities": [
    "bug-reproduction",
    "root-cause-analysis",
    "bug-fixing",
    "regression-testing",
    "bug-validation",
    "quick-deployment"
  ],
  "dependencies": [],
  "settings": {
    "type": "pipeline",
    "domains": {},
    "compatible_pipelines": []
  }
}